{"candidateSha256":"aaaaaaaaaaaaaaaaaaaaaaaaaaaaaaaaaaaaaaaaaaaaaaaaaaaaaaaaaaaaaaaa","effectiveAttemptRecordSha256s":["cccccccccccccccccccccccccccccccccccccccccccccccccccccccccccccccc"],"inputRevisionSha256":"aaaaaaaaaaaaaaaaaaaaaaaaaaaaaaaaaaaaaaaaaaaaaaaaaaaaaaaaaaaaaaaa","reviewDecisionSha256":"aaaaaaaaaaaaaaaaaaaaaaaaaaaaaaaaaaaaaaaaaaaaaaaaaaaaaaaaaaaaaaaa","reviewPacketSha256":"cccccccccccccccccccccccccccccccccccccccccccccccccccccccccccccccc","stageKind":"STORY_AC","stagePlanSha256":"bbbbbbbbbbbbbbbbbbbbbbbbbbbbbbbbbbbbbbbbbbbbbbbbbbbbbbbbbbbbbbbb","upstreamCheckpointSha256s":["cccccccccccccccccccccccccccccccccccccccccccccccccccccccccccccccc"],"validatorResultSha256":"bbbbbbbbbbbbbbbbbbbbbbbbbbbbbbbbbbbbbbbbbbbbbbbbbbbbbbbbbbbbbbbb"}
